{
  "id": "00000000-0000-0000-0000-000000000000",
  "created_at": "2026-05-15T12:00:00Z",
  "updated_at": "2026-05-15T12:00:00Z",
  "organization_id": "00000000-0000-0000-0000-000000000000",
  "application_directory_id": "00000000-0000-0000-0000-000000000000",
  "application_directory": {
    "id": "00000000-0000-0000-0000-000000000000",
    "created_at": "2026-05-15T12:00:00Z",
    "updated_at": "2026-05-15T12:00:00Z",
    "name": "example",
    "description": "example",
    "organization_id": "00000000-0000-0000-0000-000000000000",
    "external_id": "example",
    "public": true,
    "dcr": true,
    "post_login_success": true,
    "callbacks": [
      null
    ]
  },
  "agent_type": "internal"
}